[
 {
  "category": "chip",
  "subtype": "mcu",
  "id": "chip-st-stm32f405rgt6",
  "vendor": "STMicroelectronics",
  "vendor_cn": "意法半导体",
  "model": "STM32F405RGT6",
  "title": "STM32F405RGT6 带 FPU 的 Cortex-M4 主控",
  "url": "https://www.st.com/en/microcontrollers-microprocessors/stm32f405rg.html",
  "source_tier": "B",
  "verified": false,
  "last_checked": "2026-10-28",
  "price_cny": null,
  "origin": "厂商公开资料，未逐项核对到手册页码",
  "notes": "关节驱动器里最常被拿来跑 FOC 的一颗：有 FPU、双 CAN、定时器够多。踩坑点：F405 的 CAN 是 bxCAN（不是 FDCAN），要 CAN FD 得看 G4/H7。",
  "specs": {
   "cores": 1,
   "clock_mhz": 168,
   "flash_kb": 1024,
   "ram_kb": 192,
   "can": 2,
   "canfd": false,
   "voltage_V": 3.3,
   "package": "LQFP64",
   "image_url": "/parts/chip-st-stm32f405rgt6.png",
   "image_source": "厂商资料抓取（chip-st-stm32f405rgt6.png）",
   "doc_url": "https://www.st.com/en/microcontrollers-microprocessors/stm32f405rg.html",
   "doc_pdf": "https://www.st.com/resource/en/datasheet/stm32f405rg.pdf",
   "repo_urls": [
    "https://github.com/STMicroelectronics/STM32CubeF4"
   ],
   "tau_peak_Nm": null,
   "tau_rated_Nm": null,
   "gear": null,
   "mass_kg": null,
   "armature_kgm2": null,
   "kt_Nm_per_A": null
  }
 },
 {
  "category": "chip",
  "subtype": "mcu",
  "id": "chip-st-stm32g431cbu6",
  "vendor": "STMicroelectronics",
  "vendor_cn": "意法半导体",
  "model": "STM32G431CBU6",
  "title": "STM32G431CBU6 带 FDCAN 的 Cortex-M4 主控",
  "url": "https://www.st.com/en/microcontrollers-microprocessors/stm32g431cb.html",
  "source_tier": "B",
  "verified": false,
  "last_checked": "2026-10-28",
  "price_cny": null,
  "origin": "厂商公开资料，未逐项核对到手册页码",
  "notes": "做 CAN FD 关节驱动的主流选择：片上 FDCAN + 数学加速器，170 MHz。RAM 只有 32 KB —— 想在里面塞完整力矩环 + 上位机协议要算清楚。",
  "specs": {
   "cores": 1,
   "clock_mhz": 170,
   "flash_kb": 128,
   "ram_kb": 32,
   "can": 1,
   "canfd": true,
   "voltage_V": 3.3,
   "package": "UFQFPN48",
   "image_url": "/parts/chip-st-stm32g431cbu6.png",
   "image_source": "厂商资料抓取（chip-st-stm32g431cbu6.png）",
   "doc_url": "https://www.st.com/en/microcontrollers-microprocessors/stm32g431cb.html",
   "doc_pdf": "https://www.st.com/resource/en/datasheet/stm32g431cb.pdf",
   "repo_urls": [
    "https://github.com/STMicroelectronics/STM32CubeG4"
   ],
   "tau_peak_Nm": null,
   "tau_rated_Nm": null,
   "gear": null,
   "mass_kg": null,
   "armature_kgm2": null,
   "kt_Nm_per_A": null
  }
 },
 {
  "category": "chip",
  "subtype": "mcu",
  "id": "chip-espressif-esp32-s3-wroom-1",
  "vendor": "Espressif",
  "vendor_cn": "乐鑫",
  "model": "ESP32-S3-WROOM-1",
  "title": "ESP32-S3-WROOM-1 带 WiFi/BLE 的模组",
  "url": "https://www.espressif.com/en/products/modules/esp32-s3",
  "source_tier": "B",
  "verified": false,
  "last_checked": "2026-10-28",
  "price_cny": null,
  "origin": "厂商公开资料，未逐项核对到手册页码",
  "notes": "适合做「调试桥 / 遥测 / 上位机」而不是实时力矩环：WiFi 栈会打断硬实时。要做关节控制，让它当下位机的通信协处理器。 产品图待补：厂商产品页为 JS 渲染，HTML 里没有图片地址，需人工提供截图",
  "specs": {
   "cores": 2,
   "clock_mhz": 240,
   "flash_kb": null,
   "ram_kb": 512,
   "can": 0,
   "canfd": false,
   "voltage_V": 3.3,
   "package": "模组 25.5×18 mm",
   "iface": "WiFi / BLE 5 / SPI / I2C / UART",
   "image_url": null,
   "image_source": null,
   "doc_url": "https://docs.espressif.com/projects/esp-idf/en/latest/esp32s3/",
   "doc_pdf": "https://www.espressif.com/sites/default/files/documentation/esp32-s3-wroom-1_wroom-1u_datasheet_en.pdf",
   "repo_urls": [
    "https://github.com/espressif/esp-idf"
   ],
   "tau_peak_Nm": null,
   "tau_rated_Nm": null,
   "gear": null,
   "mass_kg": null,
   "armature_kgm2": null,
   "kt_Nm_per_A": null
  }
 },
 {
  "category": "chip",
  "subtype": "driver",
  "id": "chip-ti-drv8323s",
  "vendor": "Texas Instruments",
  "vendor_cn": "德州仪器",
  "model": "DRV8323S",
  "title": "DRV8323S 三相栅极驱动器（带电流采样放大器）",
  "url": "https://www.ti.com/product/DRV8323",
  "source_tier": "B",
  "verified": false,
  "last_checked": "2026-10-28",
  "price_cny": null,
  "origin": "厂商公开资料，未逐项核对到手册页码",
  "notes": "关节驱动板最常见的栅极驱动：内置三路电流放大器 + SPI 可配增益，省掉外部运放。注意它是**驱动器**不是控制器，FOC 还得由 MCU 算。 产品图待补：厂商产品页为 JS 渲染，HTML 里没有图片地址，需人工提供截图",
  "specs": {
   "voltage_V": 48,
   "voltage_range_V": "6–60 V",
   "iface": "SPI / 6×PWM",
   "ip": null,
   "package": "VQFN-40",
   "image_url": null,
   "image_source": null,
   "doc_url": "https://www.ti.com/product/DRV8323",
   "doc_pdf": "https://www.ti.com/lit/ds/symlink/drv8323.pdf",
   "repo_urls": null,
   "tau_peak_Nm": null,
   "tau_rated_Nm": null,
   "gear": null,
   "mass_kg": null,
   "armature_kgm2": null,
   "kt_Nm_per_A": null
  }
 },
 {
  "category": "chip",
  "subtype": "driver",
  "id": "chip-ti-tmc4671",
  "vendor": "Analog Devices (Trinamic)",
  "vendor_cn": "Trinamic",
  "model": "TMC4671",
  "title": "TMC4671 硬件 FOC 控制器",
  "url": "https://www.analog.com/en/products/tmc4671.html",
  "source_tier": "B",
  "verified": false,
  "last_checked": "2026-10-28",
  "price_cny": null,
  "origin": "厂商公开资料，未逐项核对到手册页码",
  "notes": "把 FOC 做进硬件：电流环在片内跑，MCU 只发目标值。省 MCU 算力，但也意味着控制带宽和环路形态被芯片定死 —— 做科研级力矩控制会受限。",
  "specs": {
   "voltage_V": 5,
   "voltage_range_V": "3.3–5 V 逻辑",
   "iface": "SPI",
   "package": "QFN-32",
   "image_url": "/parts/chip-ti-tmc4671.jpg",
   "image_source": "厂商资料抓取（chip-ti-tmc4671.jpg）",
   "doc_url": "https://www.analog.com/en/products/tmc4671.html",
   "doc_pdf": "https://www.analog.com/media/en/technical-documentation/data-sheets/TMC4671.pdf",
   "repo_urls": [
    "https://github.com/analogdevicesinc/TMC-API"
   ],
   "tau_peak_Nm": null,
   "tau_rated_Nm": null,
   "gear": null,
   "mass_kg": null,
   "armature_kgm2": null,
   "kt_Nm_per_A": null
  }
 },
 {
  "category": "chip",
  "subtype": "transceiver",
  "id": "chip-nxp-tja1051t3",
  "vendor": "NXP",
  "vendor_cn": "恩智浦",
  "model": "TJA1051T/3",
  "title": "TJA1051T/3 CAN 收发器（3.3 V 逻辑）",
  "url": "https://www.nxp.com/products/TJA1051",
  "source_tier": "B",
  "verified": false,
  "last_checked": "2026-10-28",
  "price_cny": null,
  "origin": "厂商公开资料，未逐项核对到手册页码",
  "notes": "5 V 供电、3.3 V 逻辑侧，可直接接 STM32。做四足总线时注意终端电阻只在两端各 120 Ω，中间节点别乱加。 产品图待补：厂商产品页为 JS 渲染，HTML 里没有图片地址，需人工提供截图",
  "specs": {
   "voltage_V": 5,
   "voltage_range_V": "4.5–5.5 V（VIO 3.3 V）",
   "iface": "CAN 2.0B",
   "bits": null,
   "package": "SO8",
   "image_url": null,
   "image_source": null,
   "doc_url": null,
   "doc_pdf": "https://www.nxp.com/docs/en/data-sheet/TJA1051.pdf",
   "repo_urls": null,
   "tau_peak_Nm": null,
   "tau_rated_Nm": null,
   "gear": null,
   "mass_kg": null,
   "armature_kgm2": null,
   "kt_Nm_per_A": null
  }
 },
 {
  "category": "chip",
  "subtype": "transceiver",
  "id": "chip-ti-sn65hvd230",
  "vendor": "Texas Instruments",
  "vendor_cn": "德州仪器",
  "model": "SN65HVD230",
  "title": "SN65HVD230 3.3 V CAN 收发器",
  "url": "https://www.ti.com/product/SN65HVD230",
  "source_tier": "B",
  "verified": false,
  "last_checked": "2026-10-28",
  "price_cny": null,
  "origin": "厂商公开资料，未逐项核对到手册页码",
  "notes": "3.3 V 单电源，省掉 5 V 轨。代价是共模范围与抗扰不如 5 V 器件 —— 长线束、电机旁边走线时更挑布线。 产品图待补：厂商产品页为 JS 渲染，HTML 里没有图片地址，需人工提供截图",
  "specs": {
   "voltage_V": 3.3,
   "voltage_range_V": "3–3.6 V",
   "iface": "CAN 2.0B",
   "package": "SO8",
   "image_url": null,
   "image_source": null,
   "doc_url": "https://www.ti.com/product/SN65HVD230",
   "doc_pdf": "https://www.ti.com/lit/ds/symlink/sn65hvd230.pdf",
   "repo_urls": null,
   "tau_peak_Nm": null,
   "tau_rated_Nm": null,
   "gear": null,
   "mass_kg": null,
   "armature_kgm2": null,
   "kt_Nm_per_A": null
  }
 },
 {
  "category": "chip",
  "subtype": "imu",
  "id": "chip-bosch-bmi088",
  "vendor": "Bosch Sensortec",
  "vendor_cn": "博世",
  "model": "BMI088",
  "title": "BMI088 六轴 IMU（低振灵敏）",
  "url": "https://www.bosch-sensortec.com/products/motion-sensors/imus/bmi088/",
  "source_tier": "B",
  "verified": false,
  "last_checked": "2026-10-28",
  "price_cny": null,
  "origin": "厂商公开资料，未逐项核对到手册页码",
  "notes": "四足上很常见：抗振比消费级 IMU 好，因为它是两颗独立 die。注意它的加速度计量程与带宽要在初始化里显式配，默认值往往不适合高频触地。",
  "specs": {
   "iface": "SPI / I2C",
   "odr_hz": 1600,
   "gyro_range_dps": 2000,
   "accel_range_g": 24,
   "voltage_V": 3.3,
   "package": "LGA-16",
   "image_url": "/parts/chip-bosch-bmi088.jpg",
   "image_source": "厂商资料抓取（chip-bosch-bmi088.jpg）",
   "doc_url": "https://www.bosch-sensortec.com/products/motion-sensors/imus/bmi088/",
   "doc_pdf": "https://www.bosch-sensortec.com/media/boschsensortec/downloads/datasheets/bst-bmi088-ds001.pdf",
   "repo_urls": [
    "https://github.com/boschsensortec/BMI08x_SensorAPI"
   ],
   "tau_peak_Nm": null,
   "tau_rated_Nm": null,
   "gear": null,
   "mass_kg": null,
   "armature_kgm2": null,
   "kt_Nm_per_A": null
  }
 },
 {
  "category": "chip",
  "subtype": "imu",
  "id": "chip-tdk-icm42688p",
  "vendor": "TDK InvenSense",
  "vendor_cn": "TDK 应美盛",
  "model": "ICM-42688-P",
  "title": "ICM-42688-P 六轴 IMU（低噪声）",
  "url": "https://invensense.tdk.com/products/motion-tracking/6-axis/icm-42688-p/",
  "source_tier": "B",
  "verified": false,
  "last_checked": "2026-10-28",
  "price_cny": null,
  "origin": "厂商公开资料，未逐项核对到手册页码",
  "notes": "噪声密度比 BMI088 好，价格更低，但没有 BMI088 的抗振结构。跑跳多的四足建议先看振动谱再选。 产品图待补：厂商产品页为 JS 渲染，HTML 里没有图片地址，需人工提供截图",
  "specs": {
   "iface": "SPI / I2C",
   "odr_hz": 32000,
   "gyro_range_dps": 2000,
   "accel_range_g": 16,
   "voltage_V": 1.8,
   "package": "LGA-14",
   "image_url": "/parts/tdk-icm-42688-p.png",
   "image_source": "ccc 分支（Dichen33 提交）",
   "doc_url": "https://invensense.tdk.com/products/motion-tracking/6-axis/icm-42688-p/",
   "doc_pdf": "https://invensense.tdk.com/wp-content/uploads/2020/04/ds-000347_icm-42688-p-datasheet.pdf",
   "repo_urls": null,
   "tau_peak_Nm": null,
   "tau_rated_Nm": null,
   "gear": null,
   "mass_kg": null,
   "armature_kgm2": null,
   "kt_Nm_per_A": null
  }
 },
 {
  "category": "chip",
  "subtype": "encoder",
  "id": "chip-ams-as5047p",
  "vendor": "ams OSRAM",
  "vendor_cn": "艾迈斯欧司朗",
  "model": "AS5047P",
  "title": "AS5047P 14 位磁编码器",
  "url": "https://ams.com/as5047p",
  "source_tier": "B",
  "verified": false,